{
  "schema_version": "mesh-artifact-v0",
  "crs": "EPSG:32649",
  "coordinate_units": "m",
  "vertices": [
    [
      500000,
      1000000,
      5
    ],
    [
      500002,
      1000000,
      6
    ],
    [
      500002,
      1000001,
      7
    ],
    [
      500000,
      1000001,
      8
    ]
  ],
  "triangles": [
    [
      0,
      1,
      2
    ],
    [
      0,
      2,
      3
    ]
  ]
}